{
  "schema_version": 3,
  "manifest_id": "v10-master-draft-20261009-shots",
  "video": {
    "width": 1920,
    "height": 1080,
    "fps": 30
  },
  "resourcepacks": {
    "school": {
      "path": "assets/resourcepacks/external/NicoRTX_JapaneseSchool_resources.zip",
      "sha256": "004b53d73934c1304ad0769af81c0a0d8f484008d3d4bb6b90e3805b71c2406c",
      "profile_id": "file/NicoRTX_JapaneseSchool_resources.zip"
    },
    "cast-v8": {
      "path": "assets/resourcepacks/characters-v8-1.21.1.zip",
      "sha256": "97ab4fc6b6e512a7d3c3618908138ccfc231279ff83ad9fcc399f6c903a216b2",
      "profile_id": "file/Classmate_Kanjian2_1.21.1_v8.zip"
    },
    "cast-v11": {
      "path": "assets/resourcepacks/characters-v11-1.21.1.zip",
      "sha256": "5b526531438f701f5c7298fbcd1d736877f539002b4a536bc26d1b4b59c72164",
      "profile_id": "file/Classmate_Kanjian2_1.21.1_v11.zip"
    },
    "cast-v12": {
      "path": "assets/resourcepacks/characters-v12-1.21.1.zip",
      "sha256": "739ac8196aa0d7ce24abe46cef010227db478eae20cb956ed34d3258ec02617e",
      "profile_id": "file/Classmate_Kanjian2_1.21.1_v12.zip"
    }
  },
  "masters": {
    "shared-release-event-20261006f": {
      "file": "assets/replays/v10/shared-release-event-20261006f.mcpr",
      "sha256": "2ae40121b616d541ecb58144a330bc1ed0df2b045c66b2e281c2a99582797ffc",
      "recording_date_ms": 1791295829138
    },
    "s07-continuous-20261006a": {
      "file": "assets/replays/v10/s07-continuous-20261006a.mcpr",
      "sha256": "3e376eaaf6a6da1a2a1cb96fdbbc226487493dc230963354312d811ae40c855b",
      "recording_date_ms": 1791255978022
    },
    "s01-putaway-story-20261005a": {
      "file": "assets/replays/v10/s01-putaway-story-20261005a.mcpr",
      "sha256": "e5d093245bdb4fe122d0722b84f48e8545d1f75b67a26782b3c994c426a56b61",
      "recording_date_ms": 1791176194151
    },
    "s03-mouth-story-20261005a": {
      "file": "assets/replays/v10/s03-mouth-story-20261005a.mcpr",
      "sha256": "92407a1bee4ae25410290fd9387c1b6ea00cc15244ee5b143b56f767b6f1b789",
      "recording_date_ms": 1791167567003
    },
    "s04-mouth-story-20261005a": {
      "file": "assets/replays/v10/s04-mouth-story-20261005a.mcpr",
      "sha256": "2ec8b39de75c2fb6d067c7dd477f38841609a98e29968d4827503b13269ce57e",
      "recording_date_ms": 1791166985347
    },
    "s05-mouth-story-20261005a": {
      "file": "assets/replays/v10/s05-mouth-story-20261005a.mcpr",
      "sha256": "f70c0ed26a3be85138b8495d9890261a9e9fc2ffcb55bc1d3aa6492b4c1cd4b1",
      "recording_date_ms": 1791168727309
    },
    "s06-mouth-story-20261005a": {
      "file": "assets/replays/v10/s06-mouth-story-20261005a.mcpr",
      "sha256": "75d7990a200f9d4ed880bde46ef172fdd0b95565c79f483ca3f2f137783baccd",
      "recording_date_ms": 1791169314023
    },
    "s07-street-story-20261005a": {
      "file": "assets/replays/v10/s07-street-story-20261005a.mcpr",
      "sha256": "9b8ba274a493cab5d97b575849e3432ffdba0699a3ade3293535402c7b81dbe4",
      "recording_date_ms": 1791172121703
    }
  },
  "shots": [
    {
      "shot_id": "SH_route",
      "master_id": "shared-release-event-20261006f",
      "master_sha256": "2ae40121b616d541ecb58144a330bc1ed0df2b045c66b2e281c2a99582797ffc",
      "camera_track": {
        "interpolation": "linear",
        "keyframes": [
          {
            "tick": 48,
            "position": [
              501.3,
              0.18,
              93.2
            ],
            "rotation": [
              163.5,
              -1,
              0
            ],
            "fov": 45
          },
          {
            "tick": 148,
            "position": [
              501.3,
              0.18,
              93.2
            ],
            "rotation": [
              163.5,
              -1,
              0
            ],
            "fov": 45
          }
        ]
      },
      "tick_range": {
        "start_tick": 48,
        "end_tick": 148
      },
      "resourcepack_sha256": "739ac8196aa0d7ce24abe46cef010227db478eae20cb956ed34d3258ec02617e",
      "enabled_file_profiles": [
        "file/NicoRTX_JapaneseSchool_resources.zip",
        "file/Classmate_Kanjian2_1.21.1_v12.zip"
      ],
      "width": 1920,
      "height": 1080,
      "fps": 30,
      "output": "assets/footage/v10/0a0055564263-route.mp4",
      "output_sha256": "0a005556426356381ae7af6f8a7399c02b1c8bc0e2c8c3c28dc03cbd53511f8b",
      "accepted_spec_digest": "08de726d8395c9f5f0b9fdb0eeb64b6ea3bba179af99638282af785f44fb903e"
    },
    {
      "shot_id": "SH_aid",
      "master_id": "shared-release-event-20261006f",
      "master_sha256": "2ae40121b616d541ecb58144a330bc1ed0df2b045c66b2e281c2a99582797ffc",
      "camera_track": {
        "interpolation": "linear",
        "keyframes": [
          {
            "tick": 244,
            "position": [
              494.6,
              0.18,
              93.5
            ],
            "rotation": [
              180,
              14,
              0
            ],
            "fov": 60
          },
          {
            "tick": 444,
            "position": [
              494.6,
              0.18,
              93.5
            ],
            "rotation": [
              180,
              14,
              0
            ],
            "fov": 60
          }
        ]
      },
      "tick_range": {
        "start_tick": 244,
        "end_tick": 444
      },
      "resourcepack_sha256": "739ac8196aa0d7ce24abe46cef010227db478eae20cb956ed34d3258ec02617e",
      "enabled_file_profiles": [
        "file/NicoRTX_JapaneseSchool_resources.zip",
        "file/Classmate_Kanjian2_1.21.1_v12.zip"
      ],
      "width": 1920,
      "height": 1080,
      "fps": 30,
      "output": "assets/footage/v10/6a6b2794bb78-aid-warm.mp4",
      "output_sha256": "6a6b2794bb78916ae8465e141e0fdc6fd8be9e84987759c16e801bd747294d5b",
      "accepted_spec_digest": "0960aa4801966d8c06fb7efe2bd32d04623af01056702ce13d33f2b2fdfe24c4"
    },
    {
      "shot_id": "SH_departure",
      "master_id": "shared-release-event-20261006f",
      "master_sha256": "2ae40121b616d541ecb58144a330bc1ed0df2b045c66b2e281c2a99582797ffc",
      "camera_track": {
        "interpolation": "linear",
        "keyframes": [
          {
            "tick": 444,
            "position": [
              494.6,
              0.18,
              95.5
            ],
            "rotation": [
              180,
              10,
              0
            ],
            "fov": 75
          },
          {
            "tick": 694,
            "position": [
              494.6,
              0.18,
              95.5
            ],
            "rotation": [
              180,
              10,
              0
            ],
            "fov": 75
          }
        ]
      },
      "tick_range": {
        "start_tick": 444,
        "end_tick": 694
      },
      "resourcepack_sha256": "739ac8196aa0d7ce24abe46cef010227db478eae20cb956ed34d3258ec02617e",
      "enabled_file_profiles": [
        "file/NicoRTX_JapaneseSchool_resources.zip",
        "file/Classmate_Kanjian2_1.21.1_v12.zip"
      ],
      "width": 1920,
      "height": 1080,
      "fps": 30,
      "output": "assets/footage/v10/2ceb72904d5a-departure.mp4",
      "output_sha256": "2ceb72904d5a3d4ad62bc36547c9a74f00e7517a495747c2d89a076f96ae60ca",
      "accepted_spec_digest": "7f13aee9670b1949455bd757da50d1e478a806d0d898aef925d5b1887c010921"
    },
    {
      "shot_id": "SH_phone",
      "master_id": "shared-release-event-20261006f",
      "master_sha256": "2ae40121b616d541ecb58144a330bc1ed0df2b045c66b2e281c2a99582797ffc",
      "camera_track": {
        "interpolation": "linear",
        "keyframes": [
          {
            "tick": 144,
            "position": [
              498.5,
              0.18,
              90
            ],
            "rotation": [
              108,
              3,
              0
            ],
            "fov": 45
          },
          {
            "tick": 164,
            "position": [
              498.5,
              0.18,
              91
            ],
            "rotation": [
              100,
              11,
              0
            ],
            "fov": 26
          },
          {
            "tick": 184,
            "position": [
              498.5,
              0.18,
              91
            ],
            "rotation": [
              100,
              11,
              0
            ],
            "fov": 26
          },
          {
            "tick": 244,
            "position": [
              498.5,
              0.18,
              91
            ],
            "rotation": [
              100,
              11,
              0
            ],
            "fov": 26
          }
        ]
      },
      "tick_range": {
        "start_tick": 144,
        "end_tick": 244
      },
      "resourcepack_sha256": "739ac8196aa0d7ce24abe46cef010227db478eae20cb956ed34d3258ec02617e",
      "enabled_file_profiles": [
        "file/NicoRTX_JapaneseSchool_resources.zip",
        "file/Classmate_Kanjian2_1.21.1_v12.zip"
      ],
      "width": 1920,
      "height": 1080,
      "fps": 30,
      "output": "assets/footage/v10/633994b99992-phone.mp4",
      "output_sha256": "633994b999928d8c289e381f0ca7787af3441b6dd8eca1104b2581b93e17c534",
      "accepted_spec_digest": "69b9232163acd2d1214d7efb4a650089c26491961714e0c248dcddb0e5823993"
    },
    {
      "shot_id": "SH_phone-stop",
      "master_id": "shared-release-event-20261006f",
      "master_sha256": "2ae40121b616d541ecb58144a330bc1ed0df2b045c66b2e281c2a99582797ffc",
      "camera_track": {
        "interpolation": "linear",
        "keyframes": [
          {
            "tick": 294,
            "position": [
              500.5,
              1.08,
              92.7
            ],
            "rotation": [
              180,
              6,
              0
            ],
            "fov": 48
          },
          {
            "tick": 354,
            "position": [